{
  "recordVersion": "0.1",
  "type": "world",
  "id": "io.github.example-creator.tidepool",
  "version": "1.2.0",
  "formatVersion": "0.9",
  "name": "Tidepool Station",
  "license": "CC-BY-SA-4.0",
  "archive": {
    "name": "io.github.example-creator.tidepool-1.2.0.tar.zst",
    "sha256": "5d2f0c6e3b9a41d8e7c2b0f4a6d9e1c3b5a7f9e2d4c6b8a0f1e3d5c7b9a2e4f6",
    "bytes": 48213004,
    "expandedBytes": 96424960,
    "files": 212
  },
  "requires": {
    "libraries": [
      "com.example.street@1.2.0"
    ]
  },
  "thumbnails": [
    {
      "name": "io.github.example-creator.tidepool-1.2.0.thumb-1.png",
      "sha256": "0b8e4c2a6f1d3e5b7a9c0d2e4f6a8b1c3d5e7f9a0b2c4d6e8f1a3b5c7d9e0f2a",
      "width": 1280,
      "height": 720
    }
  ],
  "source": {
    "repo": "https://github.com/example-creator/tidepool-world",
    "tag": "v1.2.0",
    "commit": "3f2a9c4e1b7d5a8c0e2f4b6d8a1c3e5f7b9d0a2c"
  },
  "tool": {
    "name": "hyprune",
    "version": "0.7.0"
  },
  "checks": {
    "schema": "pass",
    "worldCheck": "pass"
  }
}
